{
  "$schema": "./schema.json",
  "id": "funky_juggler2",
  "name": "ファンキージャグラー2",
  "aliases": [
    "ファンキー2",
    "ファンキージャグラー",
    "ファンキー"
  ],
  "updated_at": "2026-09-27",
  "theme": {
    "accent": "#7b3fbf"
  },
  "sources": [
    {
      "id": "pworld",
      "name": "P-WORLD 機種データベース「ファンキージャグラー2」",
      "url": "https://www.p-world.co.jp/machine/database/9446",
      "checked_at": "2026-09-25"
    },
    {
      "id": "ptown",
      "name": "DMMぱちタウン 機種ページ「ファンキージャグラー2」",
      "url": "https://p-town.dmm.com/machines/3961",
      "checked_at": "2026-09-25"
    },
    {
      "id": "x_2102004930035003769",
      "name": "X @RiceFieldEX（ライスEX＠ジャグラー分析ツール開発）",
      "url": "https://x.com/RiceFieldEX/status/2102004930035003769",
      "checked_at": "2026-09-27"
    }
  ],
  "basic": {
    "maker": "北電子",
    "release_date": "2021-10-04",
    "category": "6号機",
    "type": "ノーマルタイプ（完全告知）",
    "model_name": "Sファンキージャグラー2KT",
    "certification_no": "0S0234",
    "games_per_50_coins": null,
    "net_gain_per_game": null,
    "features": [
      "BIG偏向型",
      "まろ吉マシンガン・テンパイレッツゴー・ガコバズーカなどのプレミアム",
      "GOGO!ランプの完全告知"
    ],
    "summary": "BIG偏向型のジャグラー。BIG約240枚・REG約96枚。通常時は単独ボーナスとチェリー重複当選があり、GOGO!ランプが点灯すればボーナス確定。REGの設定差が大きく、設定看破のカギになる。",
    "source_ids": [
      "pworld",
      "ptown"
    ]
  },
  "settings": {
    "list": [
      "1",
      "2",
      "3",
      "4",
      "5",
      "6"
    ],
    "note": "ボーナス確率・機械割はP-WORLDの独自調査値。ブドウ・単独/重複REGはDMMぱちタウン（ガリぞう調べ）。",
    "source_ids": [
      "pworld",
      "ptown"
    ]
  },
  "spec": {
    "rows": [
      {
        "key": "payout",
        "label": "機械割",
        "format": "percent",
        "values": {
          "1": 97.0,
          "2": 98.5,
          "3": 99.8,
          "4": 102.0,
          "5": 104.3,
          "6": 109.0
        },
        "highlight": true
      },
      {
        "key": "big",
        "label": "BIG",
        "format": "fraction",
        "values": {
          "1": 266.4,
          "2": 259.0,
          "3": 256.0,
          "4": 249.2,
          "5": 240.1,
          "6": 219.9
        },
        "highlight": true
      },
      {
        "key": "reg",
        "label": "REG",
        "format": "fraction",
        "values": {
          "1": 439.8,
          "2": 407.1,
          "3": 366.1,
          "4": 322.8,
          "5": 299.3,
          "6": 262.1
        },
        "highlight": true
      },
      {
        "key": "first_hit",
        "label": "ボーナス合算",
        "format": "fraction",
        "values": {
          "1": 165.9,
          "2": 158.3,
          "3": 150.7,
          "4": 140.6,
          "5": 133.2,
          "6": 119.6
        }
      }
    ],
    "source_ids": [
      "pworld"
    ]
  },
  "probabilities": {
    "koyaku": [
      {
        "key": "budou",
        "label": "ブドウ",
        "format": "fraction",
        "values": {
          "1": 5.94,
          "2": 5.92,
          "3": 5.88,
          "4": 5.83,
          "5": 5.76,
          "6": 5.67
        },
        "highlight": true,
        "note": "ガリぞう調べ"
      },
      {
        "key": "cherry_single",
        "label": "チェリー（非同時当選）",
        "format": "fraction",
        "value": 35.62,
        "note": "設定1の値のみ公表"
      },
      {
        "key": "piero",
        "label": "ピエロ",
        "format": "fraction",
        "value": 1092.27
      },
      {
        "key": "bell",
        "label": "ベル",
        "format": "fraction",
        "value": 1092.27
      }
    ],
    "note": "ブドウに設定差あり（ガリぞう調べ）。非同時当選チェリーは設定1の値のみ公表。",
    "source_ids": [
      "ptown",
      "pworld"
    ]
  },
  "features": {
    "cz": [],
    "bonus": [
      {
        "name": "BIG CHANCE",
        "facts": [
          {
            "label": "終了条件",
            "value": "266枚を超える払い出し"
          },
          {
            "label": "平均獲得",
            "value": "約240枚"
          }
        ],
        "description": "中段チェリー停止時に中・右リールへBARをビタ押しで揃えると、BIG中のBGMが子犬のワルツ まろ吉ver.に変化。",
        "source_ids": [
          "pworld",
          "ptown"
        ]
      },
      {
        "name": "BONUS GAME（REG）",
        "facts": [
          {
            "label": "終了条件",
            "value": "98枚を超える払い出し"
          },
          {
            "label": "平均獲得",
            "value": "約96枚"
          }
        ],
        "description": "全リール適当打ちでOK。",
        "source_ids": [
          "pworld"
        ]
      }
    ],
    "at": []
  },
  "ceiling": {
    "games": {
      "text": "なし"
    },
    "games_after_reset": {
      "text": "天井なし"
    },
    "benefit": null,
    "notes": [
      "ノーマルタイプのため天井・ゾーンはない"
    ],
    "source_ids": [
      "ptown"
    ]
  },
  "zones": {
    "items": [],
    "notes": [
      "ゾーンなし"
    ],
    "source_ids": [
      "ptown"
    ]
  },
  "quit_timing": {
    "items": [
      "好きなときにヤメてOK（ボーナス成立中は揃えてから）"
    ],
    "source_ids": [
      "ptown"
    ]
  },
  "reset": {
    "items": [],
    "source_ids": []
  },
  "favorable_zone": {
    "items": [],
    "source_ids": []
  },
  "setting_estimation": {
    "probabilities": [
      {
        "key": "big",
        "label": "BIG確率",
        "observe": "総ゲーム数に対するBIG回数（データカウンターのBIG）",
        "denom_base": "total",
        "values": {
          "1": 266.4,
          "2": 259.0,
          "3": 256.0,
          "4": 249.2,
          "5": 240.1,
          "6": 219.9
        },
        "source_ids": [
          "pworld"
        ]
      },
      {
        "key": "reg_single",
        "label": "単独REG確率",
        "observe": "総ゲーム数に対する単独REG（チェリーを伴わないREG）の回数",
        "denom_base": "total",
        "values": {
          "1": 636.27,
          "2": 574.88,
          "3": 512.0,
          "4": 448.88,
          "5": 409.6,
          "6": 356.17
        },
        "weight_note": "REGの中で最も設定差が大きい要素",
        "source_ids": [
          "ptown"
        ]
      },
      {
        "key": "reg_cherry",
        "label": "チェリー重複REG確率",
        "observe": "総ゲーム数に対するチェリーと同時に当選したREGの回数",
        "denom_base": "total",
        "values": {
          "1": 1424.7,
          "2": 1394.38,
          "3": 1285.02,
          "4": 1149.75,
          "5": 1110.78,
          "6": 992.97
        },
        "source_ids": [
          "ptown"
        ]
      },
      {
        "key": "reg_total",
        "label": "REG確率（合算）",
        "observe": "単独REG＋チェリー重複REG",
        "judge": false,
        "values": {
          "1": 439.8,
          "2": 407.1,
          "3": 366.1,
          "4": 322.8,
          "5": 299.3,
          "6": 262.1
        },
        "weight_note": "単独REGとチェリー重複REGを別々に判別に使っているため、合算を入れると二重に数える",
        "source_ids": [
          "pworld"
        ]
      },
      {
        "key": "budou",
        "label": "ブドウ確率",
        "observe": "総ゲーム数に対するブドウの回数（ボーナス中は数えない）",
        "denom_base": "total",
        "values": {
          "1": 5.94,
          "2": 5.92,
          "3": 5.88,
          "4": 5.83,
          "5": 5.76,
          "6": 5.67
        },
        "weight_note": "差は小さいが試行が多い。数千G以上数えて初めて効く",
        "source_ids": [
          "ptown"
        ]
      },
      {
        "key": "bonus_total",
        "label": "ボーナス合算確率",
        "observe": "BIG＋REG",
        "judge": false,
        "values": {
          "1": 165.9,
          "2": 158.3,
          "3": 150.7,
          "4": 140.6,
          "5": 133.2,
          "6": 119.6
        },
        "weight_note": "BIG・REGを個別に使っているため判別には入れない",
        "source_ids": [
          "pworld"
        ]
      }
    ],
    "ratios": [],
    "hints": [],
    "hints_source_ids": [],
    "hints_note": "ジャグラーシリーズには設定示唆演出がない。判別はボーナス確率と小役確率で行う。",
    "observations": [
      {
        "label": "設定6の実戦値",
        "detail": "通常時2840GでBIG 1/258.2・REG 1/284.0、ブドウ1/5.63、チェリー1/37.3（DMMぱちタウンの実戦）。",
        "official": false,
        "source_ids": [
          "ptown"
        ]
      },
      {
        "label": "設定1と6のブレ幅（X・95%信頼区間）",
        "detail": "8,000G時点の95%信頼区間：REG合算は設定1 1/800〜1/296・設定6 1/400〜1/190、BR合算は設定1 1/229〜1/129・設定6 1/157〜1/96。ブドウの設定差は約1.05倍しかなく当てにしにくい。REG合算・単独REGを重視する。",
        "official": false,
        "source_ids": [
          "x_2102004930035003769"
        ]
      }
    ],
    "pending": []
  },
  "effects": {
    "items": [
      {
        "name": "打ち方ごとの機械割（ガリぞう調べ）",
        "rows": [
          [
            "設定1",
            "市場調査値97.0% / チェリー狙い97.83% / フル攻略98.57%"
          ],
          [
            "設定4",
            "102.0% / 103.40% / 104.14%"
          ],
          [
            "設定6",
            "109.0% / 111.35% / 112.08%"
          ]
        ]
      }
    ],
    "source_ids": [
      "pworld",
      "ptown"
    ]
  },
  "practical_points": {
    "items": [
      "単独REGの設定差が大きい（設定1 1/636.27 → 設定6 1/356.17）。REGは単独かチェリー重複かを分けて数える",
      "ブドウは1/6より軽いかがポイント",
      "BIG偏向型なので、BIGだけ多い台は設定の判断が難しい"
    ],
    "source_ids": [
      "pworld",
      "ptown"
    ]
  },
  "cautions": {
    "items": [
      "ボーナス確率・機械割は独自調査値",
      "REG合算とボーナス合算は内訳と重なるため判別には入れない"
    ],
    "source_ids": [
      "pworld",
      "ptown"
    ]
  }
}
